{
  "summary_bullets": {
    "Internal": {
      "Operational": [
        {
          "Risk": "Failure to Maintain Quality Standards.",
          "Severity": "Medium to High. Negative customer perception, reduced service use, damaged reputation, potential product recalls.",
          "Impact": "Loss of customers, difficulty attracting new customers, increased operational costs due to higher quality requirements or recalls, potential claims, penalties, and damages.",
          "Mitigation": "Sourcing standards, testing protocols, certifications (IIP), network modeling, operations management systems, timber sourcing from certified suppliers.",
          "Gaps": "Reliance on systems that \"may not fully mitigate the risk\". No guarantee against future quality failures or service disruptions, or product contamination."
        },
        {
          "Risk": "Reliance on Key Suppliers and Service Providers",
          "Severity": "Medium.",
          "Impact": "Loss of suppliers or interruptions in the timely delivery of supplies and services could have an adverse impact on our business, financial condition, cash flows and results of operations.",
          "Mitigation": "Not specified",
          "Gaps": "No details on plans to manage reliance on suppliers."
        }
      ],
      "Financial": [
        {
          "Risk": "Losses Due to Fraud, Negligence, Theft, or Similar Incidents by Employees or Executives.",
          "Severity": "Medium to High.",
          "Impact": "Substantial financial losses, damage to reputation, loss of business, regulatory sanctions, harm to brand, improper disclosure of confidential information.",
          "Mitigation": "Close monitoring of personnel, precautions, and systems to prevent and detect activities (unspecified).",
          "Gaps": "Precautions and systems \"may not be effective in all cases.\" It is not always possible to deter employee or executive misconduct."
        },
        {
          "Risk": "Future Issuance of Equity Shares or Convertible Securities.",
          "Severity": "Medium.",
          "Impact": "Dilution of investor shareholdings, adverse effect on trading price of Equity Shares.",
          "Mitigation": "Not specified",
          "Gaps": "This is standard for companies seeking capital, but may impact investors due to diluted ownership."
        },
        {
          "Risk": "Specified Securities Issued in the Past Year at a Price Below the Offer Price.",
          "Severity": "Low.",
          "Impact": "May affect perception of Offer Price and trading price of Equity Shares after listing.",
          "Mitigation": "Disclosure in the Draft Red Herring Prospectus.",
          "Gaps": "Potential investors may perceive the offer price to be inflated."
        }
      ],
      "Legal/Financial": [
        {
          "Risk": "Outstanding Litigation Against Company, Director, Promoter, and Senior Management.",
          "Severity": "Medium to High.",
          "Impact": "Adverse outcome may affect reputation and standing and impact future business, financial condition, cash flows and results of operations.",
          "Mitigation": "Not specified",
          "Gaps": "The document only states that these exist but does not provide details, thus leaving large gaps."
        }
      ],
      "Environmental": [
        {
          "Risk": "Failure to Effectively Manage Relationship with Natural Capital and Biodiversity.",
          "Severity": "Low to Medium.",
          "Impact": "Additional costs, loss of income, reputational damage.",
          "Mitigation": "Not specified",
          "Gaps": "The document notes that the company has not experienced such instances and provides no specific mitigation strategies."
        }
      ]
    },
    "External": {
      "Economic": [
        {
          "Risk": "Adverse Development, Slowdown in Indian Economy.",
          "Severity": "Medium to High.",
          "Impact": "Adverse impact on business, results of operations, cash flows, and financial condition. Dependent on prevailing economic conditions in India.",
          "Mitigation": "None specified.",
          "Gaps": "The company is exposed to broad economic factors and appears to have no specific strategies for mitigating these risks."
        }
      ],
      "Regulatory": [
        {
          "Risk": "Changes in Laws, Regulations, and Policies (Including Data Protection).",
          "Severity": "Medium to High.",
          "Impact": "Time-consuming and costly to resolve, may impact viability or restrict ability to grow the business. Uncertainty in interpretation or implementation.",
          "Mitigation": "None specified",
          "Gaps": "Company has to react to changes in regulations, which can be time-consuming and costly."
        }
      ],
      "Market/Regulatory": [
        {
          "Risk": "Subject to Pre-emptive Surveillance Measures by Stock Exchanges (ASM and GSM).",
          "Severity": "Low to Medium.",
          "Impact": "Increased scrutiny from stock exchanges, affecting investor confidence.",
          "Mitigation": "Compliance with stock exchange requirements.",
          "Gaps": "Inherent market risk that cannot be fully mitigated."
        }
      ]
    }
  },
  "risk_text": "Here's a structured risk summary based on the provided document chunks:\n\n**Internal Risks:**\n\n- **[Category: Operational]**\n  - Risk: Failure to Maintain Quality Standards.\n    - Severity: Medium to High. Negative customer perception, reduced service use, damaged reputation, potential product recalls.\n    - Impact: Loss of customers, difficulty attracting new customers, increased operational costs due to higher quality requirements or recalls, potential claims, penalties, and damages.\n    - Mitigation: Sourcing standards, testing protocols, certifications (IIP), network modeling, operations management systems, timber sourcing from certified suppliers.\n    - Gaps: Reliance on systems that \"may not fully mitigate the risk\". No guarantee against future quality failures or service disruptions, or product contamination.\n\n- **[Category: Financial]**\n  - Risk: Losses Due to Fraud, Negligence, Theft, or Similar Incidents by Employees or Executives.\n    - Severity: Medium to High.\n    - Impact: Substantial financial losses, damage to reputation, loss of business, regulatory sanctions, harm to brand, improper disclosure of confidential information.\n    - Mitigation: Close monitoring of personnel, precautions, and systems to prevent and detect activities (unspecified).\n    - Gaps: Precautions and systems \"may not be effective in all cases.\" It is not always possible to deter employee or executive misconduct.\n\n- **[Category: Legal/Financial]**\n  - Risk: Outstanding Litigation Against Company, Director, Promoter, and Senior Management.\n    - Severity: Medium to High.\n    - Impact: Adverse outcome may affect reputation and standing and impact future business, financial condition, cash flows and results of operations.\n    - Mitigation: Not specified\n    - Gaps: The document only states that these exist but does not provide details, thus leaving large gaps.\n\n- **[Category: Financial]**\n  - Risk: Future Issuance of Equity Shares or Convertible Securities.\n    - Severity: Medium.\n    - Impact: Dilution of investor shareholdings, adverse effect on trading price of Equity Shares.\n    - Mitigation: Not specified\n    - Gaps: This is standard for companies seeking capital, but may impact investors due to diluted ownership.\n\n- **[Category: Financial]**\n  - Risk: Specified Securities Issued in the Past Year at a Price Below the Offer Price.\n    - Severity: Low.\n    - Impact: May affect perception of Offer Price and trading price of Equity Shares after listing.\n    - Mitigation: Disclosure in the Draft Red Herring Prospectus.\n    - Gaps: Potential investors may perceive the offer price to be inflated.\n\n- **[Category: Operational]**\n  - Risk: Reliance on Key Suppliers and Service Providers\n    - Severity: Medium.\n    - Impact: Loss of suppliers or interruptions in the timely delivery of supplies and services could have an adverse impact on our business, financial condition, cash flows and results of operations.\n    - Mitigation: Not specified\n    - Gaps: No details on plans to manage reliance on suppliers.\n\n- **[Category: Environmental]**\n  - Risk: Failure to Effectively Manage Relationship with Natural Capital and Biodiversity.\n    - Severity: Low to Medium.\n    - Impact: Additional costs, loss of income, reputational damage.\n    - Mitigation: Not specified\n    - Gaps: The document notes that the company has not experienced such instances and provides no specific mitigation strategies.\n\n**External Risks:**\n\n- **[Category: Economic]**\n  - Risk: Adverse Development, Slowdown in Indian Economy.\n    - Severity: Medium to High.\n    - Impact: Adverse impact on business, results of operations, cash flows, and financial condition. Dependent on prevailing economic conditions in India.\n    - Mitigation: None specified.\n    - Gaps: The company is exposed to broad economic factors and appears to have no specific strategies for mitigating these risks.\n\n- **[Category: Regulatory]**\n  - Risk: Changes in Laws, Regulations, and Policies (Including Data Protection).\n    - Severity: Medium to High.\n    - Impact: Time-consuming and costly to resolve, may impact viability or restrict ability to grow the business. Uncertainty in interpretation or implementation.\n    - Mitigation: None specified\n    - Gaps: Company has to react to changes in regulations, which can be time-consuming and costly.\n\n- **[Category: Market/Regulatory]**\n  - Risk: Subject to Pre-emptive Surveillance Measures by Stock Exchanges (ASM and GSM).\n    - Severity: Low to Medium.\n    - Impact: Increased scrutiny from stock exchanges, affecting investor confidence.\n    - Mitigation: Compliance with stock exchange requirements.\n    - Gaps: Inherent market risk that cannot be fully mitigated.\n\n**Remarks:**\n\n*   The document emphasizes that risks described may not be exhaustive and additional risks, not currently known or deemed immaterial, may arise.\n*   Several mitigation strategies are vaguely defined or non-existent, particularly for external risks. The company is largely reactive to external events.\n*   Insurance coverage appears to be in place for several asset and liability risks, but the document cautions about the potential for insufficient coverage.\n*   The company may need to further develop risk management strategies, particularly concerning key supplier dependencies, regulatory changes, and economic downturns."
}